FileName,MovieReview,
IKL_Doc1_PiratesOfTheCaribbean:TheCurseOfTheBlackPearl,"I can not remember the last time I saw a Disney film that was as bad as this is. Why do people who have had no acting lessons and are not fully trained actors continually get acting work at the expense of those that have been fully trained and therefore can act? Johnny Depp is proof of point of someone who has absolutely no ability to act whatsoever due to having had no lessons in how to act and is the complete opposite of fully trained and yet he keeps getting work in front of someone who is fully trained! The rest of the cast did rather well with the dreadful script, the storyline was almost non-existent, and didn't do anything remotely new. If half of The scenes where buckles were swashed and cut the rest shorter there still would have been far more than enough swash buckling to suit everyone that went to see the film. At over two hours long half an hour could have been taken out and it still would have been far too long! Johnny Depp's English accent was....well....let's just say it was obvious that it was an American trying to speak in and with an English accent, unlike Kevin Costner when he did Robin Hood Prince Of Thieves! 

There was ABSOLUTELY NOTHING good about this generic pirate film. It had two story lines in it both of them having been told and shown countless times in far better ways numerous times before I wouldn't be at all surprised. OK so I Told a lie when I said there was absolutely nothing good about the film, as there was on thing good about it, the closing/end credits! Once they come on it means, thankfully, this extremely boring, exceedingly tedious film that has been stre-e-e-e-e-e-e-e-tched to as long as it can be can now be switched off!
Is this a story that inspires, captivates and entrances? That's what it's creators think it is. And far too many gullible viewers think that this is art.

But what is great about it? A little bit of swashbuckling action to begin with, and nothing new. Then the whole pursuit, cove, cave thing. Not only was the storyline descending into the abyss but so was the film. Really, what was all that cave foolishness worth? Not my time.

With the talent and the budget sunk into this project, 3/4 of the directors alive today with a good writer in tow could have made this into a movie!
The old pirate movies put this one to shame. The main couple is so dislikable with babbling honorably sounding dialogue but without showing one shred of goodness that you expect in a pirate movie. This is also reflected in the script, which makes them act as if with good intentions, but when you reflect, only to make them look good. Naturally the end is incredibly cheesy, events without motivation, impossible action, and quite good special effects and big breasts to keep the eye interested.",
IKL_Doc1_PiratesOfTheCaribbean:TheCurseOfTheBlackPearl,"The Pirates of the Caribbean the curse of the black pearl, is a very good film. Everything in this film is quite outstanding, but lets face it, people are starting to get over obsessed with this film and calling it ""The best"". I don't think it deserves to be in the TOP 250, and in a better number than IN America, Henry the Va and 21 Grams. Johnny Depp's performance is very good, funny and realistic, however, it didn't deserved an Oscar nomination. The OSCARS should pick the best performances for the nomination, but Johnny's performance was not that great. Great visuals, a nice interesting story, good performances, good make up, but it is still and will be another blockbuster film. 7.56/100
Disclaimer: I saw a moderately crappy cam-version with a crappy dub (50% translation, 50% own creation).

Most people seem to enjoy this flick and I guess that chances are that you will too. I saw it (better to say some parts of it) yesterday and to say I was disappointed is to say nothing. After about one hour my dad said he can't bear it anymore and walked out. I followed him, but later returned, since I had to kill time somehow. My mother and 19 y.o. sister moderately enjoyed it (or may be just thought it would get better), but after less than two hours said they will watch it sometime later (read 'never') and stopped it.

Well, my impression was that the movie was pretty stupid and cliche. May be not the worst script, but nothing to write home about. The acting was either over the top (Johnny Depp) or bland and boring (everyone else). There might have been some brilliant special effects that I missed on the cam-copy, but I doubt it. There was hardly any sea worth looking at, and everything else was taken out of the Hollywood library of generic effects.

If you have nothing better to do, see it on the big screen, may be it will look cool (it probably won't). Don't pay much for the tickets, though.
this movie sucks , its way too long kind of boring and a very crappy ending. the only thing that saved this movie was johnny depp . the only reason this movie made alot of money is because it was a ride at disneyland . WOW , that is so exciting , actually no it isnt this movie is the worst film i have seen ever , god i want that 2 and a half hours of my life back , and my 8 dollars , well all i have is 4 words: i hate this movie
Terrible, repelling and completely unwatchable. It makes the first Mummy look like a masterpiece. Even the visual effects are terrible and ugly to look at. And Johnny Depp's performance was bad in every way. Just because you manage to speak in a way that is hard to understand does not mean it is good acting. What was the Academy thinking have they completely lost their mind. As much as I thought Return of the King was ridiculously overrated after this abomination I am starting to respect it. After such a bad decade of bad and unoriginal movies people must have broken critical fuse and mistaken this atrocity for a great movie. When will James Cameron finally start making movies and resurrect Cinema. A very deserving 1 out of 10.",
IKL_Doc1_PiratesOfTheCaribbean:TheCurseOfTheBlackPearl,"This movie was absolutely horrible. I want that 2 hours of my life back. It is extremely predictable and written by a formula. Depp did his usual strong performance, but I wonder if he actually read the script before agreeing to do the movie. My guess is that he was looking for a money maker and the Disney logo spelled cash. It must be expensive living in France. Even though Depp performed well, the persistent intentional head bobbing was annoying. It could have been understandable if there was anything resembling a story.
How sad. I was so looking forward to this movie. I love Pirate Lore. From the director of that smash hit The Mexican, this movie sucked. It should have gotten more Disney treatment, or none at all. The story was so shallow, the characters were so shallow, that it would have maybe been a terribly entertaining film for the kids, but the movie was too dark and violent for the little ones. I thought Depp would work wonders with this, but the script was so inane. There wasn't enough meat for the adults. I didn't care at all about any of the characters. I kept wating to hear ""Ding, please turn the page."" 

Some nice moments, but just a few. Over all, a let down. Rent the Musketeer for swordplay, or rent Mutiny for munity. As for pirates, even the Pirate Movie starring Kristie McNichol was more engaging than this. And it was a musical.
There has been so much hype about this film, but in reality (well, in my opinion anyway) it is seriously bad. Let me explain myself...

Firstly, Johnny Depp, who everyone thinks has given some career-defining performance, simply hops around dressed as a woman and makes cliched little comments that really grate. Secondly, Depp and Bloom's swordfight near the beginning of the film is horrifically dull. They spend the first few minutes exchanging limp jibes (physical and verbal) walking indifferently around the set... one is left half-asleep. I know the action comes later, but this dull, empty screen-time is unusual for Disney. But the most laughable element of the film (so far) is this absolutely ridiculous idea that between the ragtag, thieving bunch that pirates were, there existed a 'code of honour'. We see in the film one of the characters asking not to be killed because, according to 'the code', she has the right to 'Parley' and can be saved from death and have a nice chat with the captain instead. When the captain later tries to distance himself from this and says that the code is 'less rules...more a set of guidelines' I was crying into my chips. This is Final Destination-quality craziness.

Anyway...just thought you should all know this film really ain't that great.
im pretty surprised that this is actually on the top 250 list, and ahead of some pretty impressive films.

I was dissapointed to say the least, when putting the disc in the dvd i thought to myself ""a good ol fashioned, pirate ghost tale, marvelous"".... ah no... suffice to say the peak was when i got a chuckle out of the scene where you see Depp standing tall and proud as he jumps down on what you expect to be a massive ship but turns out to be a dinky sailboat. That was about 5 minutes into the movie, it all went down from there. It was just boring to me, pirates who were cursed and now need the blood of a certain fellow to lift it, whoooo. Orlando Bloom was annoying, I can understand pre teenage girls waving their ""Potc"" flags because hes oh so hot(those would be the imdb users with reviews like, ""omigawd this is like tha best movie EVER, orlando bloom rules!!!111"".

My confirmation came when my sweet mother, who never has a bad word to say about anyone or anything proclaimed, ""it wasnt really good"", when an hour rolled around we had both lost all interest and i was reading comic books, glancing at the tv now and then to see if anything interesting pops up. It didnt. Finally, I fell asleep.",
,,
